{
  "version": "1.0",
  "slug": "sarah-and-alex-wedding-banner",
  "title": "Sarah & Alex",
  "subtitle": "Request the pleasure of your company to celebrate their marriage",
  "hosts": [
    "Sarah Jenkins",
    "Alexander Hayes"
  ],
  "description": "Join us for an evening of vows, seasonal dinner, and dancing under the stars at Willowbrook Estate.",
  "date_start": "2026-09-19T16:00:00Z",
  "date_end": "2026-09-19T23:30:00Z",
  "timezone": "America/New_York",
  "location": {
    "name": "Willowbrook Botanical Estate",
    "address": "450 Magnolia Lane, Charlottesville, VA",
    "map_url": "https://maps.google.com/?q=Willowbrook+Botanical+Estate+Charlottesville",
    "directions_note": "Valet parking available at the main gate."
  },
  "theme": {
    "id": "botanical-elegance"
  },
  "sections": [
    {
      "type": "hero",
      "layout": "banner",
      "eyebrow": "Wedding Celebration",
      "vibe": "An intimate evening of vows, seasonal dining, and dancing under the stars",
      "cover_image_url": "/static/img/demo-hero.webp",
      "show_countdown": true
    },
    {
      "type": "quote",
      "text": "Whatever our souls are made of, his and mine are the same.",
      "author": "Emily Brontë"
    },
    {
      "type": "carousel",
      "title": "Our Story & Moments",
      "images": [
        {
          "url": "/static/img/demo-carousel-1.webp",
          "caption": "The sunset engagement at Big Sur",
          "alt": "Sarah and Alex during golden hour engagement"
        },
        {
          "url": "/static/img/demo-carousel-2.webp",
          "caption": "Exploring the hills of Tuscany",
          "alt": "Sarah and Alex walking through countryside"
        },
        {
          "url": "/static/img/demo-carousel-3.webp",
          "caption": "Floral arrangements at Willowbrook",
          "alt": "Rose garden and glasshouse pavilion"
        }
      ]
    },
    {
      "type": "details",
      "show_map_link": true,
      "show_calendar_button": true
    },
    {
      "type": "text",
      "title": "Hope to see you there!",
      "text": "as"
    },
    {
      "type": "timeline",
      "title": "Schedule of Events",
      "items": [
        {
          "time": "4:00 PM",
          "title": "Welcome Drinks",
          "description": "Conservatory Lawn"
        },
        {
          "time": "4:45 PM",
          "title": "Ceremony",
          "description": "Rose Garden Pavilion"
        },
        {
          "time": "5:45 PM",
          "title": "Cocktail Hour",
          "description": "Passed bites & string quartet"
        },
        {
          "time": "7:00 PM",
          "title": "Seated Dinner & Toasts",
          "description": "Grand Glasshouse"
        },
        {
          "time": "9:00 PM",
          "title": "Dancing & Send-off",
          "description": "Sparkler farewell at 11:30 PM"
        }
      ]
    },
    {
      "type": "image",
      "url": "/static/img/demo-hero.webp",
      "caption": "Willowbrook Botanical Pavilion & Conservatory"
    },
    {
      "type": "text",
      "title": "Guest Transportation",
      "text": "Complimentary guest shuttles will depart from the Downtown Omni Hotel at 3:15 PM."
    },
    {
      "type": "dress_code",
      "title": "Garden Formal",
      "description": "Suits or cocktail attire. Block heels recommended for the lawn.",
      "palette_hints": ["#2A4738", "#D4AF37", "#EFEBE4", "#8A9A86"]
    },
    {
      "type": "rsvp",
      "enabled": true,
      "deadline": "2026-08-25T23:59:59Z",
      "max_party_size": 2,
      "ask_dietary": true,
      "ask_song_request": false,
      "custom_note": "Kindly RSVP by August 25th"
    },
    {
      "type": "faqs",
      "title": "Information for Guests",
      "items": [
        {
          "question": "Are children invited?",
          "answer": "We kindly request an adults-only celebration."
        },
        {
          "question": "Is transportation provided?",
          "answer": "Shuttle departs from Downtown Omni Hotel at 3:15 PM."
        }
      ]
    },
    {
      "type": "gift_registry",
      "message": "Your presence is our present. For those who wish to gift:",
      "links": [
        {
          "label": "Crate & Barrel",
          "url": "https://www.crateandbarrel.com"
        },
        {
          "label": "Honeymoon Fund",
          "url": "https://www.zola.com"
        }
      ]
    },
    {
      "type": "closing",
      "message": "We cannot wait to celebrate our special day with all of you!",
      "signoff": "With love & gratitude,",
      "hosts": "Sarah & Alexander"
    }
  ]
}
