{
  "version": "1.0",
  "slug": "aurora-annual-charity-gala",
  "title": "The Aurora Gala",
  "subtitle": "An evening of gastronomy & philanthropy supporting ocean conservation",
  "hosts": [
    "Aurora Foundation"
  ],
  "description": "Join us for an exclusive 4-course dinner, live auction, and skyline performances.",
  "date_start": "2026-10-24T19:00:00Z",
  "date_end": "2026-10-25T01:00:00Z",
  "timezone": "America/New_York",
  "location": {
    "name": "The Glasshouse",
    "address": "660 12th Avenue, New York, NY",
    "map_url": "https://maps.google.com/?q=The+Glasshouse+New+York",
    "directions_note": "VIP entrance on 48th Street."
  },
  "theme": {
    "id": "midnight-soiree"
  },
  "sections": [
    {
      "type": "hero",
      "badge": "Black Tie &bull; Oct 24, 2026",
      "show_countdown": true
    },
    {
      "type": "details",
      "show_map_link": true,
      "show_calendar_button": true
    },
    {
      "type": "timeline",
      "title": "Evening Programme",
      "items": [
        {
          "time": "7:00 PM",
          "title": "Champagne Reception",
          "description": "Caviar bar & red carpet"
        },
        {
          "time": "8:15 PM",
          "title": "Keynote & Live Auction",
          "description": "Charity art & expeditions"
        },
        {
          "time": "9:30 PM",
          "title": "Gala Dinner",
          "description": "Curated wine pairings"
        },
        {
          "time": "11:00 PM",
          "title": "Late Night Symphony",
          "description": "Terrace lounge & DJ set"
        }
      ]
    },
    {
      "type": "dress_code",
      "title": "Black Tie / Midnight Glamour",
      "description": "Tuxedos and floor-length evening gowns.",
      "palette_hints": ["#090D16", "#D4AF37", "#202C45", "#F8FAFC"]
    },
    {
      "type": "rsvp",
      "enabled": true,
      "deadline": "2026-10-01T23:59:59Z",
      "max_party_size": 4,
      "ask_dietary": true,
      "ask_song_request": false,
      "custom_note": "Confirm before October 1st"
    },
    {
      "type": "faqs",
      "title": "Gala Information",
      "items": [
        {
          "question": "Is admission tax-deductible?",
          "answer": "Yes, 80% of ticket value qualifies as a 501(c)(3) tax deduction."
        }
      ]
    },
    {
      "type": "closing",
      "message": "We look forward to an extraordinary evening together.",
      "signoff": "Warm regards,",
      "hosts": "Aurora Foundation"
    }
  ]
}
