{
  "version": "1.0",
  "slug": "lucas-30th-birthday-sunset-fiesta",
  "title": "Lucas is 30",
  "subtitle": "Golden hour spritzes, sourdough pizza, and summer vibes",
  "hosts": [
    "Lucas Morales"
  ],
  "description": "Celebrating chapter 30 with mezcal cocktails, woodfired pizza fresh from the oven, and sunset dancing overlooking the Pacific.",
  "date_start": "2026-08-22T17:30:00Z",
  "date_end": "2026-08-23T00:30:00Z",
  "timezone": "America/Los_Angeles",
  "location": {
    "name": "Cliffside Villa",
    "address": "1200 Pacific Coast Hwy, Malibu, CA",
    "map_url": "https://maps.google.com/?q=Malibu+Pacific+Coast+Highway",
    "directions_note": "Rideshare drop-off at main gate. Heated pool & fire pit lounge."
  },
  "theme": {
    "id": "golden-sunset"
  },
  "music": {
    "url": "/uploads/demo-birthday-track.mp3",
    "title": "Sunset Chill Beats",
    "autoplay": true,
    "loop": true
  },
  "splash_screen": {
    "enabled": true,
    "title": "Lucas is turning 30",
    "message": "You're invited to celebrate chapter 30 with spritzes, sourdough pizza, and sunset dancing.",
    "button_text": "Open Invitation"
  },
  "sections": [
    {
      "type": "hero",
      "eyebrow": "Chapter 30 Fiesta",
      "vibe": "Golden hour spritzes, artisanal sourdough pizza, and sunset dancing by the Pacific",
      "show_countdown": true
    },
    {
      "type": "quote",
      "text": "The best memories are made with good friends, chilled mezcal, and ocean sunsets."
    },
    {
      "type": "details",
      "show_map_link": true,
      "show_calendar_button": true
    },
    {
      "type": "timeline",
      "title": "Evening Schedule",
      "items": [
        {
          "time": "5:30 PM",
          "title": "Golden Hour Spritz Bar",
          "description": "Aperol, mezcal palomas & passed tapas by the pool"
        },
        {
          "time": "7:00 PM",
          "title": "Woodfired Pizza",
          "description": "Artisanal sourdough pies & summer garden salads"
        },
        {
          "time": "8:30 PM",
          "title": "Cake & Sunset Toast",
          "description": "Dessert, chilled prosecco & birthday toast"
        },
        {
          "time": "9:30 PM",
          "title": "DJ Beats & Fire Pit",
          "description": "Late night dancing and poolside lounge"
        }
      ]
    },
    {
      "type": "dress_code",
      "title": "Dress Code",
      "name": "Summer Chic & Warm Sunset Tones",
      "description": "Linen shirts, breezy dresses, and warm terracotta accents. Pool is heated!",
      "palette_hints": ["#D74E2A", "#F2A65A", "#FBF0E8", "#2A1C16"]
    },
    {
      "type": "rsvp",
      "enabled": true,
      "deadline": "2026-08-15T23:59:59Z",
      "max_party_size": 2,
      "ask_dietary": true,
      "ask_song_request": true,
      "custom_note": "Kindly RSVP by August 15th"
    },
    {
      "type": "faqs",
      "title": "Party FAQs",
      "items": [
        {
          "question": "Are gifts expected?",
          "answer": "No boxed gifts! Your presence and good energy are all that's wanted."
        },
        {
          "question": "Should I bring swimwear?",
          "answer": "Yes! The pool and spa will be heated throughout the evening."
        }
      ]
    },
    {
      "type": "closing",
      "message": "Bring your swimwear and good energy. See you at sunset!",
      "signoff": "Cheers,",
      "hosts": "Lucas"
    }
  ]
}
